Unnamed: 0,text,Recyclability_Negative,Recyclability_Neutral,Recyclability_Positive,Recyclability (PET)_Negative,Recyclability (PET)_Neutral,Recyclability (PET)_Positive,Recycling_Negative,Recycling_Neutral,Recycling_Positive,Future_Negative,Future_Neutral,Future_Positive
1215,dosen stti bontang sukses daur ulang limbah plastik jadi bahan bakar minyak orang lihat sampah milik nilai ekonomi  sekolah tinggi teknologi industri  stti  bontang justru lihat balik  sampah kelola baik benar  beri nilai ekonomi masyarakat  kampus bawah atap yayasan didik islam  yabis  bontang  sukses ubah limbah sampah plastik jadi bahan bakar minyak  bbm  hasil inovasi bahkan usul lomba perintah kota  pemkot  bontang oktober datang  ahmad yani  irhamni nuhardin  fitria  ratnawati  irianto  empat nama balik inovasi sebut  modal kompor gas  tabung freon  selang  tabung biskuit  empat dosen stti bontang sukses hasil bbm limbah sampah plastik  irhamni nuhardin kata  hasil teliti olah limbah sampah plastik jadi bbm ikut lomba inovasi  teliti teknologi tepat  si peena  kota bontang  lomba tahun  pemkot bontang usung inovasi tema kembang teknologi wawas lingkung  tiga hasil teliti aju stti bontang desalinasi air laut energi matahari sumber air tawar masyarakat pulau kota bontang  manfaat limbah organik produksi bahan bakar gas tambah effective microorgabism - rancang bangun sistem distilasi air laut energi surya metode desalinasi single stage flash   semua usul hasil teliti masuk si peena  semua wawas lingkung  ungkap perempuan rundung sebut  kembang teknologi wawas lingkung rujuk atur wali kota  wali  bontang nomor tahun kurang produk plastik sekali pakai  lalu kembang teknologi  harap volume sampah bontang tekan tahun   kelola sampah milik nilai ekonomi masyarakat  ucap  tahu  volume sampah kota bontang tahun bilang cukup tinggi  hari  jumlah sampah hasil masyarakat capai ton   ton sampah plastik  terang  lama  sampah plastik bontang cacah kirim pulau jawa  padahal kelola baik benar  sampah - sampah manfaat beri nilai ekonomi cukup tinggi   situ lah coba olah sendiri limbah sampah plastik kota bontang  kata  dosen tim teliti stti bontang ahmad yani tutur  jauh  olah limbah gas metan bontang  kata  limbah sampah plastik kota taman  sebut bontang - kelola sendiri kembang teknologi  sampah beri nilai ekonomi    harga bahan bakar minyak jenis premium jual rp ribu per liter  kalau limbah sampah plastik kelola sendiri  harga tekan  kata  sisi  masyarakat perlu khawatir plastik   limbah sampah kelola jadi bbm  bbm hasil bukan premium  upa solar pertalite   lama batas alat  ujar  olah sampah jadi bbm  baik irhamni  ahmad yani  tiga rekan  manfaat barang bekas beli tempat loak tabung freon  kaleng biskuit  selang besi   semua bahan beli rp ribu  hasil uji coba laku  bahan bakar minyak hasil nyata pakai buat motor  kata  ahmad yani yakin  alat olah sampah modifikasi mungkin  masyarakat bontang manfaat baik aman  sekarang tinggal bagaimana dukung dana stakeholder kait   apabila alat sederhana lurah rt  banyak sampah rang  ucap  satu kilogram sampah hasil mililiter bbm manfaat teknologi buat irhamni kawan - kawan bilang cukup sederhana  limbah sampah plastik cacah masuk tabung freon panas atas kompor gas  hasil bakar kemudian alir lalu buah selang besi dingin kaleng biskuit   minyak olah tampung toples  ahmad yani terang  ideal olah sampah plastik satu kilogram hasil bbm satu liter  batas alat  satu kilogram sampah baru mampu hasil mililiter bbm   uji  perlu laku sempurna   sisa hasil bakar manfaat paping blok  kata  irhamni cerita  olah limbah sampah pernah ajar ilmu teknik kimia  khusus konversi energi  kata  prinsip  energi ubah satu bentuk bentuk  energi musnah  hancur   sampah plastik buat bahan minyak  sekarang bagaimana olah minyak  kata ,False,False,True,False,True,False,False,False,True,False,False,True
1218,daur ulang sampah plastik jadi papan  moga manfaat  video sidalang sidalang singkat  kreasi daur ulang  salah satu proyek tunas nusa foundation cetus tahun jakarta  proyek rancang mampu dukung tiga aspek bangun lanjut  sustainable development  lingkung  ekonomi sosial  ingat tanggungjawab korporasi individual produksi sampah lalu mekanisme kreasi sampah jadi rajin kualitas siap jual komunitas ibu  remaja anak lokasi pilih ,False,True,False,False,True,False,False,False,True,False,False,True
1227,sampah pandang belah mata kalau cara manfaat nya jadi nilai ekonomi  manfaat kan daur ulang rajin  jual empul sampah  kang rongsok  dampak positif nya lingkung jadi bersih bebas sampah plastik    sadar sampah yg serak kalau jual uang buat tambah beli jajan anak  smiling face with heart - eyes  smiling face with heart - eyes  moga jadi motivasi lebih peduli lingkung folded hands,False,True,False,False,True,False,False,False,True,False,False,True
1265,daur ulang kantong plastik kresek  daur ulang botol plastik mesin daur ulang kantong plastik kresek botol plastik teknologi rancang olah sampah plastik jadi bahan baku  mesin kerja cara hancur  cuci  cair plastik pakai  baik kantong plastik kresek maupun botol plastik  jadi pellet material plastik siap proses produksi  proses daur ulang kurang jumlah sampah plastik cari lingkung  kurang butuh bahan baku plastik baru  dampak positif hemat sumber daya alam  unggul mesin daur ulang plastik letak mampu olah bagai jenis plastik efisiensi tinggi  ubah jadi produk manfaat  mesin sering industri daur ulang dukung lestari lingkung  kurang polusi plastik  hasil bahan baku manfaat bagai sektor industri  mulai buat produk plastik baru hingga barang - barang komposit  teknologi makin kembang  mesin lengkap sistem pisah otomatis proses bagai jenis plastik pisah  tingkat kualitas hasil daur ulang  daurulangplastik recyclingplastic kantongplastikkresek daurulangbotolplastik lingkunganbersih plastikdaurulang inovasidaurulang hematsumberdaya jagabumi ecofriendly,False,False,True,False,False,True,False,False,True,False,False,True
1279,hoax beras plastik bekas  ayo baca cek  ricek ikut - ikut konten narasi keliru  ira video proses buat beras palsu plastik keliru  video daur ulang plastik  industri daur ulang plastik  plastik bekas  botol  ember   cuci  cacah  leleh  lalu cetak jadi butir kecil sebut biji plastik  plastic pellets  biji plastik bentuk mirip beras  banyak orang salah paham kalau  beras palsu  fungsi biji plastik bukan konsumsi  bahan baku buat produk plastik baru ember  botol  perabot  -  literasiitupenting cekkebenaransebelumshare,False,True,False,False,True,False,False,False,True,False,False,True
1304,genox single shaft shredder v fire punya limbah plastik tumpuk  mulai usaha daur ulang  light bulb genox v solusi tepat  glowing star unggul genox v  check mark button hancur bagai jenis plastik  hdpe  pp  pet   check mark button mesin kuat  awet  cocok kerja berat check mark button hemat energi  awat mudah check mark button efisiensi tinggi  hasil potong rapi  rata check mark button cocok industri daur ulang skala kecil hingga tengah genox v  proses daur ulang jadi lebih cepat untung  money bag telephone receiver tarik  tanya harga  info lengkap sekarang ,False,True,False,False,False,True,False,True,False,False,False,True
1310,pet  polyethylene terephthalate  plastik buat wadah paling umum pasar minum ringan  botol plastik  kode tulis pet  pete arti kemas plastik sebut buat polyethylene terephthalate  kemas tahan panas mudah pecah  kemas pet jadi primadona industri daur ulang  bukan arti nang pet mudah  rata - rata sampah pilah jadi pilah dulu  desain kemas banyak edar sulit jenis botol langsung daur ulang  lalu proses lepas tutup lepas label lebih  redesign kemas salah satu solusi cepat proses daur ulang pet hindar label multilayer  upaya kurang sampah solusi baik  ga nyampah  yuuk kurang sampah  kalau ga nyampah jangan nyampah - wilda yanti -,False,False,True,False,False,True,False,False,True,False,False,True
1316,alir murni hidrasi sehat  aqua milik komitmen dukung tumbuh ekonomi sirkular kemas plastik indonesia  hadir inovasi botol buat  plastik daur ulang  daur ulang transparan pertama indonesia  awal bal  kini baik alam baik hidup terus alir capai ibu kota  aqualife temu aksi nyata komitmen bijakberplastik aqua supermarket dekat ,False,False,True,False,False,True,False,False,True,False,False,True
1328,sore juragan  sen mesin plastic melter  olah sampah plastik jadi paving block plastik  mesin press hidrolik botol plastik juragan halmahera bp  samsul  monggo desa  lembaga bundesliga maupun posyantek yg minat teknologi olah sampah rapat kubajatani  terimakasih  kubajatanidemak kubajataniteknik kubajatanimachinery kubajataniindonesia kubajataniengineering kubajatani mesinpresshidrolik pressbotolplastik presshidrolik plasticdensifier plasticmelterkubajatani plasticmelter melter pengolahansampahplastik mesinpengolahansampah bumdes dlh dpkplh teknologitepatguna mesinpertanian mesinindustri pavingblockplastik pencetakpavingplastik,False,False,True,False,False,True,False,True,False,False,False,True
1332,yuk lihat bagaimana olah sampah plastik limbah tani jadi barang nila ekonomis  solusi jembrana selamat lingkung tingkat tani  jembranakembalijaya jembranamaju,False,False,True,False,True,False,False,False,True,False,False,True
1333,tahu usaha jerman germany turut olah sampah plastik indonesia  unjung fasilitas alba tridi tangerang lihat langsung proses ubah botol pet jadi serpih plastik  olah jadi produk baru  alba tridi sendiri rupa joint venture alba jerman tridi oasis group  startup daur ulang asal indonesia  terima kasih atas tur diskusi tarik dubes jerman  sukses kontribusi alba tridi langsung bumi recycling symbol  globe showing asia - australia ,False,True,False,False,False,True,False,False,True,False,False,True
1342,bangun pabrik olah sampah plastik jadi bahan bakar minyak  bbm  jenis solar science technology and industrial park  stipark  banyumulek kapasitas ton per hari  pt  geo trash management  gtm  selaku investor kembang pabrik skala besar wilayah tpa regional kebon kongok kapasitas ton per hari ,False,False,True,False,True,False,False,True,False,False,False,True
1346,kudus  isknews  com  olah sampah plastik kudus makin kembang buka peluang ekonomi masyarakat  sunarto  anggota dprd kudus fraksi pdip kelola salah satu pusat olah sampah plastik daerah sebut  jelas minta plastik daur ulang terus tingkat  utama industri jepara solo  sunarto  proses olah sampah plastik mulai kumpul pulung warga mandiri kumpul plastik bekas ,False,False,True,False,True,False,False,False,True,False,False,True
1363,mahasiswa itn malang teliti efisiensi conveyor angkut sampah plastik daur ulang optimal itnmalangnews  tingkat volume sampah plastik jadi perhati serius bagai wilayah  bagai upaya laku kurang sampah plastik  salah satu daur ulang  harap kurang sampah plastik tempat buang sampah  sekaligus hasil produk baru  mudah proses daur ulang  tempat daur ulang butuh conveyor  mesin angkut  ruben tiofanto hutabarat  lulus baik program studi teknik mesin s - fakultas teknologi industri  fti  institut teknologi nasional malang  itn malang  laku teliti analis bagaimana beban angkut pengaruh kerja mesin angkut  conveyor  mesin cacah sampah plastik  teliti berangkat sadar olah sampah plastik jadi partikel kecil lalu mesin cacah rupa langkah penting proses daur ulang  mesin conveyor sendiri peran penting pindah sampah plastik tuju mesin cacah  bawah bimbing dosen dr  eko yohanes setyawan  st  mt  teliti tuju tahu bagaimana variasi berat sampah angkut pengaruh cepat efisiensi kerja conveyor   paham pengaruh beban kerja conveyor  optimal proses daur ulang  tingkat produktivitas kurang beban kerja manual pindah sampah  ujar ruben  raih ipk  ikut wisuda wisuda periode tahun  teliti ruben libat ancang uji mesin conveyor cacah sampah bagai material besi siku  besi kanal u  gear  rantai  bearing  motor gerak  proses uji laku variasi rasio gear ukur cepat mesin angkut beban sampah beda - beda  conveyor ukur panjang cm  lebar cm  tinggi cm  cepat motor awal rpm gearbox  hasil teliti harap beri kontribusi signifikan dunia industri conveyor  khusus aplikasi olah sampah plastik  data akurat kena pengaruh beban  industri daur ulang rancang sistem conveyor lebih efisien  hemat waktu  kurang beban fisik kerja  ruben rupa putra pasang charles antofa hutabarat  tiorida silitonga  selesai didik sekolah tengah atas sma hang tuah sidoarjo  lama kuliah pemuda asal sidoarjo sempat kenyam suka duka jadi ojek online sejak semester   banyak waktu luang  ikut organisasi  makanya narik ojek online   cukup tambah uang saku  hari rata - rata ribu rupiah  suka jalan - jalan malang raya  kalau duka kadang order sepi  ungkap  kondisi sepi biasa satu customer  banyak mahasiswa   mita erminasari  humas itn malang ,False,False,True,False,True,False,False,False,True,False,True,False
1373,banyak tingkah bener si bapak satu  kan  perintah  anak yg wp  norak banget main politik  awas loh pa kalo rasa bom rela lengser tiba jatuh paksa opname rs paman usman loh  beaming face with smiling eyes note  berita mulyono yg muat media mainstream rilis tulis yg sengaja kirim tim media  humas  mantan presiden loh  ajiib dah  postpowersyndrome jakarta  detik  com -- presiden - republik indonesia joko widodo  jokowi  unjung bank sampah banjarnegara  bsb  desa kasilib  wanadadi  banjarnegara  jokowi dukung olah sampah plastik dorong ekonomi sirkular  dasar terang tulis terima  selasa  kunjung jokowi bank sampah banjarnegara laku senin  jokowi lihat olah sampah plastik jadi bahan bakar petasol  jokowi antusias lihat langsung proses buat mesin olah sampah plastik  lihat olah sampah plastik mulai cacah plastik hingga jadi petasol  jokowi lihat langsung petasol mesin traktor sawah ,False,False,True,False,True,False,False,False,True,False,False,True
1389,sampah plastik sikap baik jadi sumber ekonomi baru  sirkular ekonomi  olah sampah plastik jadi produk daur ulang kontribusi kurang gas emisi rumah kaca picu panas global dampak ubah iklim ,False,False,True,False,True,False,False,False,True,False,False,True
1391,pernah lihat proses sampah plastik jadi bahan bakar  kalau  kalian mampir lho desa gorontalo  labu bajo  sini lihat langsung  circular economy  jalan  nelayan bawa sampah plastik laut pantai  bawa tempat olah sampah  kemudian proses jadi bahan bakar nelayan laut  upaya tegas gerak cepat bangkit ekonomi cipta lapang kerja depan lanjut lingkung masalah sampah sering jadi destinasi - destinasi wisata solusi ,False,True,False,False,True,False,False,False,True,False,False,True
1393,jokowi kunjung bank sampah banjarnegara  dorong ekonomi sirkular olah sampah plastik jokowi ekonomisirkular banksampah banjarnegara pengolahansampah sampahplastik petasol indonesiabersih lingkunganhidup inovasihijau virtualbrowsing,False,False,True,False,True,False,False,False,True,False,False,True
1423,daur ulang kantong plastik kresek  daur ulang botol plastik mesin daur ulang kantong plastik kresek botol plastik teknologi rancang olah sampah plastik jadi bahan baku  mesin kerja cara hancur  cuci  cair plastik pakai  baik kantong plastik kresek maupun botol plastik  jadi pellet material plastik siap proses produksi  proses daur ulang kurang jumlah sampah plastik cari lingkung  kurang butuh bahan baku plastik baru  dampak positif hemat sumber daya alam  unggul mesin daur ulang plastik letak mampu olah bagai jenis plastik efisiensi tinggi  ubah jadi produk manfaat  mesin sering industri daur ulang dukung lestari lingkung  kurang polusi plastik  hasil bahan baku manfaat bagai sektor industri  mulai buat produk plastik baru hingga barang - barang komposit  teknologi makin kembang  mesin lengkap sistem pisah otomatis proses bagai jenis plastik pisah  tingkat kualitas hasil daur ulang  daurulangplastik recyclingplastic kantongplastikkresek daurulangbotolplastik lingkunganbersih plastikdaurulang inovasidaurulang hematsumberdaya jagabumi ecofriendly,False,False,True,False,False,True,False,False,True,False,False,True
1438,dulu  plastik bekas anggap sampah  tangan mas ikbal   sampah plastik ubah jadi plakat unik kamu pajang  bahkan jual  awal resah lihat tumpu limbah tempat tinggal  ikbal gak mau diam aja  mulai eksperimen  kumpul plastik  cair  cetak  cat  hingga lahir plakat daur ulang punya nilai lebih  buat kamu mau ikut bisnis sama  tips kamu coba mulai riset jenis plastik apa aman pakai ulang  cetak plakat sederhana awal produksi  jangan ragu ajar komunitas daur ulang  tambah sentuh desain bikin orang tarik beli tampil  plakatdaurulang bisnisdaurulang ekonomisirkular genzbergerak bisniskreatifindonesia recycleart idebisnis inspirasibisnisanakmuda pengusahamuda daurulangplastik karyadarisampah,False,True,False,False,False,True,False,False,True,False,False,True
1443,proses daur ulang sampah plastik  jadi biji plastik olah jadi bagai macam produk nila ekonomis  inovasi daurulangplastik jangkauansemuaorang ikut,False,True,False,False,False,True,False,False,True,False,False,True
1445,recycling symbol mesin gilling limbah plastik  solusi daur ulang efektif recycling symbol mesin gilling limbah plastik alat rancang hancur cacah limbah plastik jadi serpih kecil  teknologi canggih  mesin bantu proses daur ulang jadi lebih efisien ramah lingkung  sparkles unggul mesin gilling limbah plastik  check mark button efisiensi tinggi  mampu cacah bagai jenis plastik cepat  check mark button ramah lingkung  kurang limbah plastik dukung daur ulang  check mark button konstruksi kuat  buat material tahan lama jangka panjang  check mark button hemat energi  konsumsi daya rendah hasil maksimal  envelope with arrow dm info lebih lanjut langsung order via whatsapp  mobile phone with arrow  one o  clock  jam operasional  spiral calendar senin - jumat   -  spiral calendar sabtu   -  round pushpin head office  jl  candipuro no  a  rt  rw  pacar keling  kec  tambaksari  surabaya  jawa timur globe with meridians kunjung website  cek link bio  daurulangplastik recycle gogreen mesinindustri pengolahanlimbah plasticshredder ecofriendly cahayaagroteknik sustainability limbahplastik,False,False,True,False,False,True,False,True,False,False,False,True
1448,halo calon usaha  pojok plastik punya solusi kamu mau mulai usaha ngga punya lahan luas loh  salah satu paket usaha pojok plastik  kamu punya bisnis daur ulang sampah plastik cukup lahan garasi halaman rumah  penasaran  mau tau cara  tunggu apa  let  s join us  informasi lebih lanjut  kalian unjung website hubung   bisnis daurulang sampahplastik pojokplastik indonesia,False,False,True,False,True,False,False,False,True,False,True,False
1477,shodaqoh sampah tempat buat khusus sampah botol plastik sampah botol plastik daur ulang kurang sampah plastik hasil nila ekonomis moga inspirasi sahabat fb,False,False,True,False,False,True,False,False,True,False,False,True
1481,ketua umum asosiasi daur ulang plastik indonesia  adupi  christine halim tampil salah orang bicara webinar  tantang peluang bisnis daur ulang plastik indonesia masa pandemi  jumat sore  juni gelar krista  adupi ipf  indonesia packaging federasi  christine nyata  lihat volume timbul sampah indonesia capai juta ton  persen sampah plastik  kolaborasi selesai soal sampah plastik plastik circular economy sekaligus tingkat recycling rate bawah persen  bijak hambat iklim tumbuh daur ulang minta kaji ulang  wastemanagement circulareconomy indonesiagogreen,True,False,False,True,False,False,True,False,False,True,False,False
1497,sisi  tingkat daur ulang sampah plastik jumlah timbul sampah plastik sangat rendah sampah plastik jadi soal besar lindung lestari lingkung hidup  masalah sampah lebih dar masalah teknis rupa jadi cermin perilaku masyarakat lingkung  ubah kelola sampah mulai biasa hari - hari laku konsisten beri dampak besar lingkung  cara efektif kelola sampah plastik  jalan bisnis daur ulang plastik  informasi lebih lanjut  kalian unjung website hubung   bisnis daurulang sampahplastik pojokplastik indonesia,True,False,False,True,False,False,True,False,False,True,False,False
1501,mau punya bisnis daur ulang plastik  bingung pasar  bantu mulai buat mesin pasar hasil produksi  sedia buat  baik mesin daur ulang plastik  - mesin crusher  giling - mesin extruder  pelet - mesin tali rafia - mesin straw  sedot tlp  wa  bengkelbubut daurulang daurulangplastik mesindaurulangplastik mesingilingplastik mesinpeletplastik mesintalirafia mesinsedotan,False,False,True,False,False,True,False,False,True,False,False,True
1557,sempat batas  milik mesin giling plastik harga jangkau  cari solusi tingkat efisiensi daur ulang plastik  mesin giling plastik pilih baik bagai butuh industri olah limbah  rancang hancur bagai jenis plastik efisien aman  mesin siap bantu jaga lingkung sekaligus tingkat produktivitas  unggul produk   kapasitas giling besar konsisten  struktur kokoh tahan lama  operasi mudah aman  garansi bulan opsi kustomisasi warna nikmat harga spesial bulan  hubung sekarang info lebih lanjut konsultasi gratis telephone -- daur ulang jadi lebih mudah mesin giling plastik  solusi efektif hasil kerja kualitas tinggi ,False,False,True,False,False,True,False,False,True,False,False,True
1562,ready suppliyer keranjang merah industri liter bahan  plastik murni  bukan daur ulang   plastik bau  warna original  tarik  kuat kokoh  sedia warna merah,False,True,False,False,True,False,False,True,False,True,False,False
1569, globe showing asia - australia  plastik bukan trend  pilih kemas ramah lingkung   globe showing asia - australia  dunia makin sadar penting jaga lingkung  green heart kemas eco - friendly paperbag  box daur ulang  label ramah lingkung bukan pilih   bisnis alih  four leaf cloverrecycling symbol ecofriendlyliving kurangiplastik sustainablepackaging tunggu  yuu buru order  shopping cart order  wa  -- klik link bio custom paper bag kampoeng hijaupackaging wrap box roll label hangtagtas furingstiker amplop alas kaki cuci mobil cherriesdesign gratis sesuai selera cherriesharga lebih murah pesan pcs cherriesbisa custom ukur  bentuk jenis kertas cherriesramah lingkung kampoenghijau daruratsampahjogja taskertasgrosir taskertasjogja paperbagjogja paperbagcustom paperbagbatik paperbagkekinian gogreen jogjadaruratsampah ordernow,False,True,False,False,True,False,False,True,False,False,False,True
1572,ready suppliyer keranjang merah industri liter bahan  plastik murni  bukan daur ulang   plastik bau  warna original  tarik  kuat kokoh  sedia warna merah,False,True,False,False,True,False,True,False,False,True,False,False
1597,astungkara  selalu syukur folded handsfolded handsfolded hands produk umkm citra mandiri kreatif open po meja  kursi daur ulang sampah plastik  ukur   pcs  meja size xxcm  pcs  kursi size xxcm bahan  - papan plastik daur ulang - rangka besi hollow - meja xcm - kursi  x  cm - cat hitam doff - proses kerja hari harga idr   harga masuk ongkir  minat dm  messenger info  papan yg murni proses daur ulang sampah plastik type hdpe  pp ldpe  hasil lembar papan dgn uk  xm tebal cm butuh  kg sampah plastik  jadi logika nya proses olah hasil daur ulang sampah plastik banyak kg utk lembar papan  produksi trus lanjut ikan nilai manfaat lebih sampah plastik buang tpa ikut produk daur ulang sama - sama ikut jaga alam bangun buah putar ekonomi  so  retorika teriak - teriak ttg isu lingkung utama sampah plastik  gak jaman nya sob  sampah plastik butuh tata kelola solusi olah tepat tepat sasar  video  by devandra olah bukan pindah balirarepaduraksa wedooworkshopbali rumahplastik rumahplastikmart gerakanolahplastik tebekomposter kembaliorganik jempengmesari samtaku olahsampahdarisumber,False,True,False,False,True,False,False,False,True,False,False,True
1615,masyarakat banyak tahu kena produksi sampah plastik upa paving blok  manfaat area kantor pemkot mataram jadi sosialisasi masyarakat  adapun cara efektif kelola sampah  jalan bisnis daur ulang plastik  informasi lebih lanjut  kalian unjung website hubung   bisnis daurulang sampahplastik pojokplastik indonesia,False,False,True,False,False,True,False,False,True,False,False,True
1616,pet  polyethylene terephthalate  plastik buat wadah paling umum pasar minum ringan  botol plastik  kode tulis pet  pete arti kemas plastik sebut buat polyethylene terephthalate  kemas tahan panas mudah pecah  kemas pet jadi primadona industri daur ulang  bukan arti nang pet mudah  rata - rata sampah pilah jadi pilah dulu  desain kemas banyak edar sulit jenis botol langsung daur ulang  lalu proses lepas tutup lepas label lebih  redesign kemas salah satu solusi cepat proses daur ulang pet hindar label multilayer  upaya kurang sampah solusi baik  ga nyampah  yuuk kurang sampah  kalau ga nyampah jangan nyampah - wilda yanti -,True,False,False,True,False,False,True,False,False,True,False,False
1625,kemarin komunitas plastik baik sempat kunjung pt tridi oasis group tangerang  pt tridi oasis group rupa usaha gerak bidang daur ulang botol plastik bekas  hasil wawancara mba dian kurniawati selaku salah satu founder tridi oasis  tridi sedang laku inovasi daur ulang plastik - plastik multilayer  turut coba sebut plastik multilayer jadi furniture  kendala pandemi covid inovasi lanjut  dian kurniawati sebut pandemi cukup pengaruh bisnis gelut  mau tau bincang - bincang lengkap salah satu founder tridi oasis  tunggu video lengkap channel plastik baik yaa  plastikuntukkebaikan plastikbernilaiekonomi plastik botolbekas tiktok moneyheist viral newnormal perubahandimulaidarirumah pilahsampahdarirumah perubahandimulaidarisekarang sedekahbotolplastik circulareconomy circulareconomiplastic,True,False,False,False,False,True,True,False,False,False,False,True
