Unnamed: 0,text,Recyclability_Negative,Recyclability_Neutral,Recyclability_Positive,Recyclability (PET)_Negative,Recyclability (PET)_Neutral,Recyclability (PET)_Positive,Recycling_Negative,Recycling_Neutral,Recycling_Positive,Future_Negative,Future_Neutral,Future_Positive
21,nuning sulistyani olah sampah plastik jadi peluang bisnis,False,True,False,False,True,False,False,False,True,False,False,True
22,menteri siti nurbaya ajak masyarakat olah sampah plastik jadi sumber daya ekonomi,False,True,False,False,True,False,False,False,True,False,False,True
31,menteri siti nurbaya ajak masyarakat olah sampah plastik jadi sumber daya ekonomi,False,True,False,False,True,False,False,False,True,False,False,True
38,menteri lhk ajak masyarakat olah sampah plastik jadi sumber daya ekonomi,False,True,False,False,True,False,False,False,True,False,False,True
48,perintah ajak masyarakat olah sampah plastik jadi sumner daya ekonomi  ekonomirimeningkat,False,True,False,False,True,False,False,False,True,False,False,True
49,usung sirkular ekonomi kemenperin dukung industri olah sampah plastik,False,False,True,False,True,False,False,False,True,False,False,True
53,klhk ajak masyarakat olah sampah plastik jadi sumber daya ekonomi ,False,True,False,False,True,False,False,False,True,False,False,True
54,keren  bank sampah olah limbah plastik jadi nila ekonomi bacadibj beritajakarta dkijakarta banksampah,False,True,False,False,True,False,False,False,True,False,False,True
73,nestl luncur bangku kerangka buat  daur ulang plastik sachet pasca - konsumsi  komitmen nestl dukung tingkat angka daur ulang  amp  ekonomi sirkular,False,False,True,False,True,False,False,False,True,False,False,True
74,sambut datang usaha kolombia bidang daur ulang plastik dubes ri tatang razak tim ekonomi papar potensi ekonomi regulasi investasi indonesia  inidiplomasi rintiskemajuan,False,False,True,False,True,False,False,True,False,False,True,False
78,wujud komitmen dukung program perintah kait kelola sampah plastik ekonomi sirkular coca - cola diri fasilitas daur ulang botol plastik pet kelola pt amandina bumi nusantara  simak insight with hari cnn indonesia ,False,False,True,False,False,True,False,True,False,False,False,True
85,salah satu tempat daur ulang botol plastik lombok pet kawasan ranji lombok barat  salah satu unit bisnis daur ulang recycling business unit damping indonesia kelola ud lombok pet  circulareconomy bijakberplastik,False,False,True,False,False,True,False,True,False,False,False,True
86,sejak danone - aqua lalu dekat ekonomi sirkular turut andil sukses komitmen perintah kurang  sampah plastik laut indonesia tahun  ekonomi sirkular ala aqua fokus manfaat limbah plastik bahan daur ulang,False,False,True,False,False,True,False,False,True,False,False,True
89,danone aqua jadi pelopor kemas ramah lingkung tahun lewat aqua galon  bisnis sirkular  danone aqua ambil langkah besar bantu selesai sampah plastik indonesia luncur aqua life buat  plastik daur ulang ,False,False,True,False,False,True,False,False,True,False,False,True
93,usaha daur ulang sampah plastik indonesia  lndustri daur ulang plastik nasional proyeksi terus tumbuh  kendala klasik adang bisnis manfaat buat lingkung ,True,False,False,False,False,True,False,False,True,False,False,True
101,halo sobat laut sedang langsung fgd susun pedoman kelola sampah plastik alat tangkap ikan ayo kembang industri daur ulang alat tangkap ikan indonesia minim aldfg marinedebris tknpsl,False,False,True,False,True,False,False,True,False,False,True,False
102,pt coca cola europasific partners indonesia tanam investasi besar rp miliar bangun fasilitas daur ulang sampah plastik kawasan industri cikarang ,False,False,True,False,False,True,False,True,False,False,False,True
103,pj  bupati bekas damping menteri koordinator bidang maritim investasi republik indonesia luhut binsar pandjaitan rangka resmi pabrik daur ulang botol plastik jenis polyethylene terephthalate  pet ,False,False,True,False,False,True,False,True,False,False,False,True
111,kunjung services indonesia salah satu mitra bisnis daur ulang - aqua sampah kemas plastik kumpul olah standar jadi material rpet  recycle pet  untukbahan baku botol plastik baru  bijakberplastik,False,True,False,False,False,True,False,True,False,False,False,True
119,investor takut investasi indonesia pdn gampang bocor produk buat plastik daur ulang,False,True,False,True,False,False,False,True,False,True,False,False
121,bank mandiri jadi bank pertama indonesia terbit kartu debit kartu prabayar e - money bahan plastik pvc daur ulang  bisnisupdate update bisnis text,False,False,True,False,True,False,False,True,False,False,False,True
122,tim kampanye jelajah bersih negeri singgah pabrik daur ulang plastik veolia indonesia kawasan pasuruan industrial estate rembang  pier  pasuruan jawa timur februari ,False,False,True,False,True,False,False,True,False,False,True,False
132,ipi terus juang ekosistem  amp  sirkuler ekonomi sampah daur ulang plastik utama kantong kresek jokowi klhk indonesia bumnuntukindonesia kemenperin pupr,False,False,True,False,True,False,False,True,False,False,False,True
133,kota deltamas sama pemkab bekas hadir inovasi aspal bahan plastik daur ulang jakarta adopsi konsep ekonomi sirkular indonesia pimpin solusi efektif kelola limbah plast,False,False,True,False,True,False,False,False,True,False,False,True
134,daur ulang indonesia terlalu maju  anak muda buat jam tangan sampah plastik sinar terang usaha startup henti rusa lingkung  sedang proses dukung giat maksimal ,False,False,True,False,True,False,False,False,True,False,False,True
136,pantas laku bisnis sampah kok sedikit indonesia  kalau aku tajir sih  kapan wkwk  aku mau bangun pabrik daur ulang sampah plastik,False,False,True,False,True,False,False,True,False,False,True,False
145,makanya gk heran sampah plastik pet jadi primadona dunia  ketua umum asosiasi daur ulang plastik indonesia  adupi  christine halim kata sampah plastik pet  polyethylene terephthalate  sangat mati industri daur ulang seluruh dunia ,False,False,True,False,False,True,False,True,False,False,False,True
152,sudrajad tuju impor sampah plastik utama bahan baku daur ulang lebih murah banding plastik baru  untung industri daur ulang ekonomi utama negara kembang indonesia margin untung - tantang besar  banyak,True,False,False,False,False,True,False,False,True,False,False,True
161,kontribusi kelola sampah plastik indonesia unit bisnis daur ulang daya pulung jadi laku industri ekonomi sirkular,False,True,False,False,True,False,False,False,True,False,False,True
162,coca - cola europacific partners indonesia dynapack asia resmi fasilitas daur ulang botol plastik pet bekas  sustainable sustainability lanjut lanjut csr majalahcsrid indonesia bisnisberkelanjutan botolpet botolplastik,False,False,True,False,False,True,False,True,False,False,False,True
169,anak artis amerika serikat zooey deschanel viral kirim surat startup daur ulang indonesia request plastik rasa cokelat ,False,True,False,False,True,False,False,True,False,False,False,True
170,luncur pabrik daur ulang botol plastik ccep indonesia dynapack asia promosi dekat sebut - sebut pacu ekonomi sirkular bantu atas masalah lingkung  baca artikel lengkap green network indonesia ,False,False,True,False,False,True,False,True,False,False,False,True
172,coba kalau gin apa gak malu  bukan prestasi yg dunia malah sampah yg dunia  pabrik daur ulang sampah hrus galak ekonomi sirkular jg makin tumbuh  sampah plastik indonesia temu dampar hingga afrika,False,True,False,True,False,False,False,True,False,True,False,False
173,padahal banyak potensi cuan hasil dri daur ulang sampah jadi kembang ekonomi sirkular  tingkat daur ulang sampah plastik indonesia rendah,True,False,False,False,False,True,False,False,True,False,False,True
175,indonesia mampu laku tinggal tunggu gercep mas tweet  amp  buat atur kota  amp  kabupaten punya bumd pabrik daur ulang plastik  amp  serentak  serap tenaga kerja tumbuh ekonomi indonesia  bravo,False,False,True,False,True,False,False,False,True,False,False,True
177,ketua umum asosiasi daur ulang plastik indonesia  adupi  christine halim ungkap industri daur ulang mampu jadi hubung lingkar ekonomisirkular lama sambung  stage,False,False,True,False,False,True,False,True,False,False,False,True
186,jatim jajak olah sampah plastik jadi listrik industri,False,True,False,False,True,False,False,False,True,False,False,True
192,pemkab kobar cari ide olah sampah plastik jadi barang ekonomi,False,True,False,False,True,False,False,True,False,False,False,True
193,pemkab kobar cari ide olah sampah plastik nila ekonomis,False,True,False,False,True,False,False,True,False,False,False,True
201,klhk ajak masyarakat olah sampah plastik jadi sumber daya ekonomi,False,True,False,False,True,False,False,False,True,False,False,True
220,industrialisasi zero waste kini ntb mampu olah sampah plastik jadi solar,False,False,True,False,True,False,False,True,False,False,False,True
226,klhk ajak masyarakat olah sampah plastik jadi sumber daya ekonomi,False,True,False,False,True,False,False,False,True,False,False,True
278,hilir memang betul  contoh jangan daun teh tweet misal batubara jadi dme sampah plastik jadi listrik teknologi yg mungkin terap indonesia  amp  angkat sosial ekonomi masyarakat ,False,False,True,False,True,False,False,False,True,False,False,True
284,wakil ketua komisi vii dpr ri evita nursanty minta menteri industri  kemenperin  dukung upaya wujud bal bebas sampah plastik sekali pakai larang produksi air minum kemas ,False,True,False,True,False,False,False,True,False,True,False,False
295,latih daur ulang sampah plastik sma st  yosef surakarta jadi barang nila ekonomis ,False,False,True,False,True,False,False,False,True,False,False,True
299,wagub nyanyang kunjung pt  free the sea tinjau industri daur ulang sampah plastik batam,False,False,True,False,True,False,False,True,False,False,False,True
311,brin dorong inovasi teknologi iradiasi daur ulang plastik bas ekonomi sirkular,False,False,True,False,True,False,False,False,True,False,False,True
322,unilever indonesia ajak masyarakat libat aktif kelola sampah plastik lalu edukasi ekonomi sirkuler sampah plastik rumah tangga,False,False,True,False,True,False,False,False,True,False,False,True
343,mesin extruder lembar plastik solusi canggih produksi lembar plastik kualitas tinggi  teknologi modern mesin mampu hasil material kuat presisi serbaguna  extruderplastik mesinindustri manufaktur injectionmolding teknologiindustri,False,True,False,False,True,False,False,True,False,False,False,True
355,indonesia ekonomi sirkular jadi solusi kurang bocor kelola sampah plastik  mubadalahid,False,True,False,False,True,False,False,False,True,False,False,True
366,tsai jin peng sosok diri merek ramah lingkung for next generation  fng fokus teknologi benang daur ulang botol plastik pet  tsai jin - peng tekad praktek konsep ekonomi sirkular anggap bahan benang daur ulang,False,True,False,False,False,True,False,False,True,False,False,True
376,salah satu tempat daur ulang botol plastik lombok pet kawasan ranji lombok barat  salah satu unit bisnis daur ulang recycling business unit damping indonesia kelola ud lombok pet  circulareconomy bijakberplastik,False,True,False,False,False,True,False,True,False,False,False,True
378,pj  bupati bekas damping menteri koordinator bidang maritim investasi republik indonesia luhut binsar pandjaitan rangka resmi pabrik daur ulang botol plastik jenis polyethylene terephthalate  pet ,False,False,True,False,False,True,False,True,False,False,False,True
380,aqua wujud bisnis lanjut daur ulang pet aqua bisnisberkelanjutan daurulang lingkung plastikpet ekonomihijau sustainability industriminuman,False,False,True,False,False,True,False,True,False,False,False,True
381,pantes galon sekali pakai jadi primadona industri daur ulang krn sangat mudah bahan utk daur ulang jadi bagai produk yg milik nilai tinggi geotekstil dakron pakai  siapa sangka olah pet nyata jadi salah satu sumber ekspor indonesia ,False,False,True,False,False,True,False,False,True,False,False,True
384,tahu lebih jelas kena kontribusi rantai nilai sampah plastik minum ringan ekonomi sirkular swi laku riset wilayah jabodetabek lama periode maret agustus  riset sebut tingkat daur ulang recycling rate botol pet,False,True,False,False,False,True,False,True,False,False,False,True
388,sampah galon sekali pakai jadi incar industri daur ulang  sejak mengunakan galon sekali pakai jadi tahu nyata galon pet idola industri daur ulang pantesan jenis plastik pet banyak cari pulung punya nilai cukup tinggi ,False,True,False,False,False,True,False,True,False,False,False,True
389,plastik bahan pet ramah lingkung mudah daur ulang  bahkan hasil riset swi daur ulang plastik pet kontribusi besar bg ekonomi masyarakat khusus kepul sampah  jadi kepul sampah plastik pet ibarat  emas  yg sangat laku jual ,False,True,False,False,False,True,False,True,False,False,False,True
398,jadi pakai tshirt  amp  sepatu hasil daur ulang jg potensi bahaya  blm atur regulasi  negeri regulator aman pangan malah justru cawe - cawe urus saing bisnis  konsisten lawan bahaya kandung bpa  amp  senyawa yg pet ,False,True,False,True,False,False,False,True,False,True,False,False
399,kunjung services indonesia salah satu mitra bisnis daur ulang - aqua sampah kemas plastik kumpul olah standar jadi material rpet  recycle pet  untukbahan baku botol plastik baru  bijakberplastik,False,False,True,False,False,True,False,False,True,False,False,True
400,jakarta - usaha daur ulang limbah pet indonesia pt inocycle technology group tbk  inov  ambil langkah strategis tingkat jual lalu diversifikasi bisnis  baca lengkap   idnfinancials inov jual beritasaham,False,False,True,False,False,True,False,True,False,False,False,True
402,kalau udh ga jadi pot galon pet masuk pabrik daur ulang plastik  serap industri daur ulang thd galon pet paling tinggi galon bekas ukur besar mudah kelola tarik buat pulung nilai ekonomi tinggi ,False,True,False,False,False,True,False,False,True,False,False,True
406,investasi nila rp miliar produksi pet daur ulang  recycled pet  rpet  kurang plastik murni  virgin pet ,False,False,True,False,False,True,False,True,False,False,False,True
407,wujud praktik bisnis ramah lingkung pt namasindo plas energi surya buat botol pet daur ulang,False,False,True,False,True,False,False,True,False,False,True,False
408,marak investasi pabrik daur ulang pet menperin  wujud ekonomi sirkular industri hijau bigdata database dataresearch,False,False,True,False,False,True,False,False,True,False,False,True
409,galon sekali pakai jadi primadona industri daur ulang krn saking mudah bahan utk daur ulang jadi bagai produk yg milik nilai tinggi geotekstil dakron pakai  bahkan olah pet nyata jadi salah satu sumber ekspor indonesia lho ,False,True,False,False,False,True,False,True,False,False,False,True
410,coca - cola europacific partners indonesia  ccep indonesia  baru resmi pabrik daur ulang botol plastik polyethylene terephthalate  pet  rabu  kawasan industri cikarang bekas jawa barat ,False,False,True,False,False,True,False,False,True,False,False,True
414,galon bekas le minerale harga rp kilogram kata kepul sampah langgan ku memang harga galon pet lumayan mahal sangat suka industri daur ulang jadi tinggal pilih mau jual daur ulang jadi kreasi pot bunga ,False,True,False,False,False,True,False,False,True,False,False,True
415,ri galon bpa harga kemas lebih mahal daya saing laku industri nya rendah nah galon pet harga kemas lebih murah justru daya siang laku usaha lebih tinggi  hasil daur ulang limbah galon pet jadi produk turun baru agam ,False,True,False,False,False,True,False,True,False,False,False,True
416,jangan malu aku galon sekali pakai inovasi baik bahan pakai pet jadi punya nilai tinggi utk daur ulang stop bodoh masyarakat penting bolak balik fakta yg benar lindung bisnis satu pihak ,False,False,True,False,False,True,False,True,False,False,False,True
417,makanya gk heran sampah plastik pet jadi primadona dunia  ketua umum asosiasi daur ulang plastik indonesia  adupi  christine halim kata sampah plastik pet  polyethylene terephthalate  sangat mati industri daur ulang seluruh dunia ,False,False,True,False,False,True,False,True,False,False,False,True
419,resmi pabrik daur ulang pet teknologi food grade menperin optimistis kuat ekosistem daur ulang ekonomi sirkular ,False,False,True,False,False,True,False,False,True,False,False,True
422,bangun fasilitas daur ulang sampah plastik rupa bentuk komitmen dukung konsep ekonomi lanjut patut apresiasi ,False,False,True,False,True,False,False,True,False,False,False,True
423,fokus resin kemas pet daur ulang amandina komitmen jalan praktik industri lanjut,False,False,True,False,False,True,False,True,False,False,False,True
430,pet milik nilai ekonomi relatif tinggi stabil sifat - sifat warna jernih ringan mudah bentuk mudah pecah  jenis plastik banyak butuh industri daur ulang jadi solusi yg efektif,False,True,False,False,False,True,False,False,True,False,False,True
431,galon isi ulang yg bahan bpa kategori material plastik paling sulit daur ulang  jelas bahaya lingkung  galon pet paling mudah nila daur ulang  mudah kelola kumpul nilai ekonomi tinggi jadi suka kumpul sampah ,False,True,False,False,False,True,False,True,False,False,False,True
432,punya nilai ekonomis daur ulang galon sekali pakai jauh lebih tinggi banding kemas gelas botol kecil sekali pakai  gak percaya  coba cek deh tpa kalian temu galon pet gunung sampah sortir pulung ,False,True,False,False,False,True,False,True,False,False,False,True
436,tengah isu lingkung makin desak industri daur ulang hadap tantang besar ,False,True,False,False,True,False,True,False,False,False,True,False
440,suram suram bahan baku pet impor kata sampah botol aqua gak beguna dong mata industri daur ulang,False,True,False,True,False,False,False,True,False,True,False,False
447,sayang banget industrial daur ulang ganjal sampah pet,False,True,False,True,False,False,False,True,False,True,False,False
452,industri daur ulang kira roket buah proyeksi baru kira industri daur ulang roket capai nilai rp  triliun  plastik pet muncul pelopor tempat pangsa persen ,False,False,True,False,False,True,False,True,False,False,False,True
453,wujud komitmen dukung program perintah kait kelola sampah plastik ekonomi sirkular coca - cola diri fasilitas daur ulang botol plastik pet kelola pt amandina bumi nusantara ,False,False,True,False,False,True,False,True,False,False,False,True
454,dukung industri lanjut mayora group hadir pabrik daur ulang pet lokal teknologi foodgrade,False,False,True,False,False,True,False,True,False,False,False,True
455,booth le minerale jakarta fair mayor  jfk  beri edukasi konsumen  adapun edukasi kait produk daur ulang pet nila ekonomi ,False,False,True,False,False,True,False,True,False,False,False,True
458,enzim lcc temu teliti mampu urai plastik utama pet kini mulai skala industri perancis  carbios pabrik daur ulang rencana bangun kapasitas daur ulang  ton limbah pet per tahun enzim lcc ,False,False,True,False,False,True,False,True,False,False,False,True
459,pt inocycle technology group tbk  nov  usaha daur ulang limbah plastik jenis pet  polyethylene terephthalate  tambah lini bisnis baru buat resin  chips daur ulang  lengkap,False,False,True,False,False,True,False,True,False,False,False,True
461,grup alba bangun pabrik daur ulang sampah plastik jenis pet food grade kendal industrial park mampu olah  ton limbah botol plastik per tahun ,False,False,True,False,False,True,False,True,False,False,False,True
462,bumi indus padma jaya pabrik daur ulang pet lokal indonesia pertama teknologi foodgrade yakin dukung industri lanjut,False,False,True,False,False,True,False,False,True,False,False,True
464,revolusi industri kemas pangan  sip tetap standar kemas minum bahan  pet daur ulang  rpet ,False,False,True,False,False,True,False,False,True,False,False,True
473,coca - cola europacific partners indonesia dynapack asia resmi fasilitas daur ulang botol plastik pet bekas  sustainable sustainability lanjut lanjut csr majalahcsrid indonesia bisnisberkelanjutan botolpet botolplastik,False,False,True,False,False,True,False,True,False,False,False,True
483,wujud praktik bisnis ramah lingkung pt namasindo plas energi surya buat botol pet daur ulang,False,True,False,False,False,True,False,False,True,False,False,True
495,galon isi ulang yg bahan bpa kategori material plastik paling sulit daur ulang  jelas bahaya lingkung  galon pet paling mudah nila daur ulang  mudah kelola kumpul nilai ekonomi tinggi jadi suka kumpul sampah ,False,True,False,False,False,True,False,False,True,True,False,False
508,indonesia sulit cari untung bisnis  omset daur ulang plastik memang janji capai rp juta  bulan  net income rp juta  sungguh ironis ingat tuju awal beri dampak positif lingkung hidup ekonomi masyarakat ,True,False,False,True,False,False,False,True,False,True,False,False
535,kunjung pabrik naga kuda brand batas maros - makassar  takjub tangan ibu feni tim semua jenis sampah plastik olah seluruh jadi produk nila ekonomi ,False,True,False,False,False,True,False,False,True,False,False,True
549,csr aft babullah hasil manfaat sampah plastik jadi barang nila ekonomis buat batu bata paving block batu angin  sampahplasik csrpertamina,False,True,False,False,False,True,False,False,True,False,False,True
590,indonesia udh yg nama bank sampah kok  cuma emg sadar diri masing aja yg kurang ka  laku bisnis daur ulang sampah plastik kok  kalo sadar diri tinggi sih enak gaperlu gaji pulung utk keliling udh yg nyetor lapak ,True,False,False,False,False,True,True,False,False,False,False,True
600,parah sebenernya ga efektif sistem daur ulang indonesia  jangan e - waste plastik aja kacrut  terus kalo mau pake paper bag rata sini blm pake yg murni daur ulang krn supplynya kurang buat bisnis ,True,False,False,False,True,False,True,False,False,False,True,False
626,yantie ekaputri produsen yg ngeyel soal kemas plastik ukur kecil kan kurang minat industri daur ulang,False,True,False,True,False,False,True,False,False,True,False,False
628,jang dongmin nyata bisnis kaya raya  punya warnet  pc bang  usah jasa bersih bersih rumah usaha daur ulang botol plastik pas kecil jarang banget liat ortunya  yg kerja keras senin sampe senin  pergi gelap pulang dah gelap ,False,False,True,False,False,True,False,True,False,False,False,True
637,usaha daur ulang plastik kemas plastik sekali pakai nila tinggi material daur ulang bahan baku produksi pabrik makin banyak material daur ulang makin baik industri plastik negara sangat kurang bahan baku ,False,False,True,False,False,True,True,False,False,False,False,True
641,topnewsmetrotv perintah milik perhati olah sampah plastik upaya terus dorong industri daur ulang plastik nasional  perintah optimis daur ulang sampah plastik kembang  daur ulang sampah plastik untung ,True,False,False,False,False,True,True,False,False,False,False,True
652,gantung indonesia sampah impor industri daur ulang timbul tantang signifikan  kurang bahan baku negeri terus jadi utama sektor pulp kertas plastik ,True,False,False,True,False,False,True,False,False,True,False,False
659, kembang industri daur ulang plastik negeri terus kebut perintah upaya strategis substitusi bahan baku impor  samping butuh bahan baku plastik sangat tinggi  visi industridaurulang,True,False,False,False,False,True,True,False,False,False,False,True
660,indonesia juang lepas diri gantung sampah impor jadi sangat penting industri daur ulang utama produksi kertas plastik ,True,False,False,False,False,True,True,False,False,False,False,True
664,unpopular opinion  gausah esktrim batasin plastik  plastik limbah yg daur ulang lama layak  industri banyak yg gantung sama daur ulang plastik  pulung aja jtan sini yg jadi ujung tombak pabrik  bukan arti pake enak ,False,False,True,False,True,False,False,False,True,False,True,False
666,menteri industri airlangga hartarto kata upaya daur ulang plastik alias recycle plastic indonesia kalah negara maju ,True,False,False,False,True,False,True,False,False,False,True,False
677,kampos usaha startup asal italia produksi pakai renang kemeja t - shirt  amp  mana seluruh produk buat botol plastik daur ulang  bekas  meski bukti banyak masyarakat plastik hindar  larang ,True,False,False,False,False,True,True,False,False,False,False,True
679,tp gue cukup penasaran botol daur ulang aqua ngambil source pet le minerale  masyarakat paham aja kalo benar industri manufaktur plastik source utama bukan virgin plastik bekas  yes they  re recyclable ,False,True,False,False,False,True,False,True,False,False,False,True
686, sampah plastik bahan baku industri daur ulang negeri  jadi lebih tengah  lebih tengah impor,True,False,False,True,False,False,True,False,False,True,False,False
692,halo sobat laut sedang langsung fgd susun pedoman kelola sampah plastik alat tangkap ikan ayo kembang industri daur ulang alat tangkap ikan indonesia minim aldfg marinedebris tknpsl,False,False,True,False,False,True,False,True,False,False,False,True
705,menteri industri airlangga hartarto kata upaya daur ulang plastik alias recycle plastic indonesia kalah negara maju ,True,False,False,False,True,False,True,False,False,False,True,False
708, peluang kembang industri daur ulang plastik indonesia nilai cukup besar ingat daur ulang sampah rumah tangga level ,True,False,False,True,False,False,True,False,False,True,False,False
710,plastik bahan milik tingkat daur ulang cukup tinggi plastik bekas milik nilai ekonomi jadi bahan baku olah proses reuse   maupun recycle  daur ulang  proses jadi ulang - ulang ,False,True,False,False,False,True,False,False,True,False,False,True
717,olah daur ulang sampah plastik perlu tingkat  plastic finance salah satu platform yg tawar investasi yg ramah lingkung fokus sistem daur ulang sampah  plasfuture zerowaste plasticfinance,False,False,True,False,True,False,True,False,False,False,True,False
