Unnamed: 0,text,Recyclability_Negative,Recyclability_Neutral,Recyclability_Positive,Recyclability (PET)_Negative,Recyclability (PET)_Neutral,Recyclability (PET)_Positive,Recycling_Negative,Recycling_Neutral,Recycling_Positive,Future_Negative,Future_Neutral,Future_Positive
720,padahal banyak potensi cuan hasil dri daur ulang sampah jadi kembang ekonomi sirkular  tingkat daur ulang sampah plastik indonesia rendah,True,False,False,False,True,False,True,False,False,False,True,False
745,adupi  industri daur ulang plastik pulih tahun depan,True,False,False,False,True,False,True,False,False,False,True,False
751,beberapa sektor udah jalan  industri daur ulang plastik  inov  daur ulang logam berat  mhki  proyek biomassa  amp  wte  oasa toba  sinkron  amp  dukung penuh bijak nasional ,True,False,False,False,True,False,True,False,False,False,True,False
756,tahu plastik urai jadi bahan bakar butuh kg sampah plastik hasil satu galon bensin  tahu industri daur ulang plastik milik kerja sangat buruk   sampah pernah hasil,True,False,False,False,False,True,True,False,False,False,False,True
762,prospek industri daur ulang plastik indonesia tahun depan kira bakal makin suram lantar dampak perang dagang reda ,True,False,False,False,True,False,True,False,False,False,True,False
764,daur ulang indonesia terlalu maju  anak muda buat jam tangan sampah plastik sinar terang usaha startup henti rusa lingkung  sedang proses dukung giat maksimal ,False,False,True,False,False,True,False,False,True,False,False,True
773,pusat riset ekonomi perilaku sirkuler badan riset inovasi nasional  brin  teliti potensi sampah plastik kemas lap layak daur ulang nila tinggi  iptek adadikompas,False,False,True,False,False,True,False,True,False,False,False,True
777,ipi  ikat pulung indonesia  punya juta anggota  industri daur ulang plastik tiap kota  industri petrokimia kawasan cilegon industri kemas makan  semua serap bas juta tenaga kerja  amp  investasi trilyunan rupiah ,False,False,True,False,True,False,False,False,True,False,True,False
779,bukan cuma lingkung daur ulang sampah plastik bantu putar ekonomi loh  mulai ber kawanplastik ,False,False,True,False,False,True,False,False,True,False,False,True
789, ubah sampah plastik yg tolak kepul  loak jadi paving block  keren hasil daur ulang keren sumber nyerap sampah yg serap industri daur ulang skrg ,False,True,False,False,False,True,False,False,True,False,False,True
792,perintah maju payung industri daur ulang plastik tanah air yg jadi kontributor kuat ekonomi nasional ,True,False,False,False,True,False,True,False,False,False,True,False
796,exactly jey  aku ga tuju sedot sama gelas plastik hitung per pc  mending ikut cara udah laku hitung per kg  industri daur ulang efektif mindset orang - orang tahap environmental ,True,False,False,False,True,False,True,False,False,False,True,False
797,soal investasi industri daur ulang sampah plastik tantang luar biasa abrek  salah satu pilah sampah optimal  industri daur ulang mau repot mem bersih ,True,False,False,False,True,False,True,False,False,False,True,False
812,laksono solusi jangka pendek  kalau mau loh sampah jangka panjang proses lama  dsn industri dukung  misal daur ulang sampah plastik punya  kalau datang usaha asing perlu dana  sabar lah dulu miskin ,True,False,False,True,False,False,False,True,False,True,False,False
815,kondisi jadi makin berat butuh sampah kemas sachet besar  beda butuh industri daur ulang sampah botol plastik pet  sampahsachetsiapapunya adaapasampahsachet  kemanaperginyasampahsachet,False,True,False,False,True,False,True,False,False,True,False,False
819,peran industri daur ulang sampah khusus plastik sangat penting konsep ekonomi sirkular lingkar  hadir mampu hadir produk inovasi daur ulang sampah plastik ,False,False,True,False,False,True,False,False,True,False,False,True
826,daur ulang filter terracycle steril cabik - cabik kemudian campur filter dng material daur ulang  mungkin filter utk lebur dlm plastik industri yg macam kayu plastik kualitas rendah  terimakasihkretek,False,False,True,False,True,False,False,False,True,False,True,False
828,giling banyak yg rugi rusak rantai daur ulang plastik  sadar bisnis baik win solution rendah,True,False,False,True,False,False,True,False,False,True,False,False
831,rakyat ekonomi rendah jaga alam kecil  ga buang sampah sembarang  biasa daur ulang kurang konsumsi plastik kertas air listrik apa lebih,False,False,True,False,False,True,False,False,True,False,False,True
836,sampah plastik daur ulang manfaat  milik nilai ekonomis  rendah,False,True,False,False,False,True,True,False,False,False,False,True
846,waketum adupi wiganda sampah jenis sachet plastik multilayer nilai ekonomis sangat rendah  minat pulung pulung sampah sachet sangat kecil  amp  butuh industri daur ulang sampah kemas sachet jg sgt rendah sampahsachetsiapapunya,False,True,False,False,True,False,True,False,False,True,False,False
854,pslb botol plastik plastik daun maupun perabot plastik  daur ulang  bahkan jadi komoditas ekonomi sayang perhati perintah sangat rendah usaha daur ulang plastik sering kena dampak naik turunya harga plastik ,True,False,False,False,False,True,True,False,False,False,False,True
863,las main nbyl yantie stpl industri daur ulang sangat suka kalau ukur sampah plastik pet besar galon  lama industri daur ulang jarang mau daur ulang sampah plastik aqua botol apa sampah plastik banyak yg kotor nya minta ampun,False,True,False,False,False,True,True,False,False,True,False,False
867,banyak sampah plastik aqua mini yg jarang industri mau daur ulang nih,False,True,False,True,False,False,True,False,False,True,False,False
869,gimana orang kebaya sampah plastik aqua mini yg jarang industri mau daur ulang,False,True,False,True,False,False,True,False,False,True,False,False
886,gunung sampah plastik datang industri daur ulang negara - negara maju  desa sumengko utara jadi salah satu destinasi akhir produk - produk plastik hasil daur ulang  recyclingisnotenough breakfreefromplastic pantangplastik,True,False,False,True,False,False,True,False,False,True,False,False
887,proses daur ulang galon sekali pakai sendiri rupa salah satu solusi manfaat sampah plastik beban lingkung bahkan banyak negara maju siklus ekonomi daur ulang limbah plastik anggap salah satu solusi kelola limbah yg cukup,False,False,True,False,False,True,False,False,True,False,False,True
893,jadi entrepreneur usia tahun henti kerja usia tahun patah semangat paul tasner mulai bisnis daur ulang plastik ubah sampah jadi kemas ramah lingkung ,False,False,True,False,True,False,False,False,True,False,True,False
896,makin hari makin banyak masyarakat akrab giat daur ulang plastik  tuju ekonomi sadar penting bebas lingkung sampah plastik  bethehero,False,False,True,False,False,True,False,False,True,False,False,True
902,hi sobatbinamarga  teknologi campur aspal limbah plastik rupa buah upaya kurang sampah plastik laut  marine debris  indonesia utama limbah kantong kresek cenderung harga pasar industri daur ulang ,False,False,True,False,True,False,True,False,False,False,False,True
903,manfaat alias daur ulang  bantu - bantu kurang sampah plastik lingkung tempat tinggal  kamu jadi lahan bisnis baru  sekarang banyak produk barang pakai tas bahkan keranjang pakai buat sampah plastik ,False,True,False,False,False,True,False,False,True,False,False,True
908,misal pilih jawab ikut  a  produksi sampah b  sampah plastik c  daur ulang d  biji plastik e  nilai ekonomi mana masuk kelompok kata pasang  daur ulang  selalu pasang ganti ,False,True,False,False,True,False,False,True,False,False,True,False
924,atas masalah sampah plastik dekat produktif  yuk sobatproksi manfaat sampah plastik cipta barang daur ulang manfaat milik nilai ekonomis  selamat hari peduli sampah  februari,False,False,True,False,True,False,False,False,True,False,False,True
938,anak - anak muda kembang bisnis ramah lingkung  sampah plastik selalu mubazir  model bisnis sedia barang curah layan angkut sampah hingga daur ulang sampah plastik  majalahtempo,False,False,True,False,False,True,False,False,True,False,False,True
943,investasi nila rp miliar produksi pet daur ulang  recycled pet  rpet  kurang plastik murni  virgin pet ,False,False,True,False,False,True,False,False,True,False,False,True
945,adupi  asosiasi daur ulang plastik indonesia  mudah lulus seleksi beli giling cuci  mampu bikin produk baru punya nilai tambah ekspor  jadi beda industri daur ulang plastik kertas,False,True,False,True,False,False,True,False,False,True,False,False
950,padahal ingat sampah plastik  total sampah anorganik sampah plastik sangat butuh industri daur ulang jadi aneh bila masalah buah kalimat urai urai  featuredkompasiana,False,True,False,False,False,True,False,False,True,False,False,True
960,tuju ekonomi sirkular kurang gap kapasitas industri daur ulang limbah plastik daur ulang kondisi ekonomi linier beri insentif nyata daur ulang  hampir semua produksi akhir buang  sampah ,False,False,True,False,False,True,False,False,True,False,False,True
970,narasi yg buat produsen galon bpa alih jelas galon pet kode daur ulang mudah daur ulang jadi primadona industri daur ulang  beda cerita dngn kemas kecil sampah plastik aqua gelas yg gak laku tambah galon pc kode yg daur ulang,False,True,False,False,False,True,True,False,False,True,False,False
975,ketua umum asosiasi daur ulang plastik indonesia  adupi  christine halim ungkap industri daur ulang mampu jadi hubung lingkar ekonomisirkular lama sambung  stage,False,False,True,False,False,True,False,False,True,False,False,True
988,bisnis  kisah sukses dagang kue kering natal tahun baru  pecat kantor orang akhir sukses buka usaha daur ulang plastik   modal batok kelapa orang akhir kaya dadak kuissmartbisnis kuy ah sae ajax,False,False,True,False,True,False,False,False,True,False,True,False
990,tsai jin peng sosok diri merek ramah lingkung for next generation  fng fokus teknologi benang daur ulang botol plastik pet  tsai jin - peng tekad praktek konsep ekonomi sirkular anggap bahan benang daur ulang,False,False,True,False,False,True,False,False,True,False,False,True
999,salam zero waste  industri bahan bakar fosil  alias plastik  brand nama aju solusi palsu buruk masalah iklim  apa sebut bioplastik daur ulang bahan kimia selesai masalah malah tambah ,True,False,False,False,True,False,True,False,False,True,False,False
1000,manfaat sampah nonorganik plastik  amp  botol plastik bekas bukan laku industri daur ulang skala besar semata  nyata sampah sebut hasil nilai ekonomi tangan laku umkm gas pol lingkung,False,False,True,False,False,True,False,False,True,False,False,True
1047,airlangga  industri daur ulang plastik kena ppn keluar,True,False,False,False,True,False,True,False,False,False,True,False
1048,peluang ekonomi daur ulang plastik tuh sebenernya banyak bgt  muncul larang solusi olah limbah,True,False,False,True,False,False,True,False,False,True,False,False
1051,industri daur ulang plastik rupa salahsatu industri yg dampak besar lama masa pandemi covid - utilisasi produksi capai - persen ,True,False,False,False,True,False,False,True,False,False,True,False
1052,tarik sejati industri kemas plastik buat fatamorgana soal daur ulang plastik  lebih rekayasa sana sini biar olah ramah thd lingkung  biaya daur ulang mahal teknologi ,True,False,False,True,False,False,True,False,False,True,False,False
1056,tinggal larang export bahan mentah plastik pet daur ulang ln tumbuh investasi industri daur ulang seluruh wilayah nusantara tumbuh jawa timur banten  bagaimana mau bersih indonesia nilai ekonomis habis transportasi ,True,False,False,True,False,False,True,False,False,True,False,False
1070,sampah plastik bukan masalah lingkung masalah kelola sampah  kembang teknologi daur ulang ubah sampah jadi sumber daya dorong ekonomi sirkular ,False,False,True,False,False,True,False,False,True,False,False,True
1085,baik wilayah dki punya tpst integrasi dgn pltsampah  amp  industri bahan baku sampah anorganik shg sisa daur ulang sampah sedikit  amp  tdk perlu bawa tpst bantar gebang  rw punya bank sampah yg tukar sampah plastik - logam - kaca dgn tiket transj  amp  krl ,True,False,False,True,False,False,True,False,False,True,False,False
1088,sampah plastik selesai dgn bentuk bank sampah yg tukar sampah anorganik dgn poin e - money yg pakai utk belanja apa  bank sampah kerjasama dgn industri daur ulang sampah shg sampah tpa sangat sedikit jumlah ,False,False,True,False,False,True,False,False,True,False,False,True
1105,tren pariwisata ekonomi kreatif gerak arah gaya hidup lanjut  sustainable lifestyle  mulai konsumsi tanggung jawab energi baru baru hingga daur ulang lebih sedikit plastik ,False,False,True,False,False,True,False,False,True,False,False,True
1119,dosen stti bontang sukses daur ulang limbah plastik jadi bahan bakar minyak orang lihat sampah milik nilai ekonomi  sekolah tinggi teknologi industri  stti  bontang justru lihat balik  sampah kelola baik benar  beri nilai ekonomi masyarakat  kampus bawah atap yayasan didik islam  yabis  bontang  sukses ubah limbah sampah plastik jadi bahan bakar minyak  bbm  hasil inovasi bahkan usul lomba perintah kota  pemkot  bontang oktober datang  ahmad yani  irhamni nuhardin  fitria  ratnawati  irianto  empat nama balik inovasi sebut  modal kompor gas  tabung freon  selang  tabung biskuit  empat dosen stti bontang sukses hasil bbm limbah sampah plastik  irhamni nuhardin kata  hasil teliti olah limbah sampah plastik jadi bbm ikut lomba inovasi  teliti teknologi tepat  si peena  kota bontang  lomba tahun  pemkot bontang usung inovasi tema kembang teknologi wawas lingkung  tiga hasil teliti aju stti bontang desalinasi air laut energi matahari sumber air tawar masyarakat pulau kota bontang  manfaat limbah organik produksi bahan bakar gas tambah effective microorgabism - rancang bangun sistem distilasi air laut energi surya metode desalinasi single stage flash   semua usul hasil teliti masuk si peena  semua wawas lingkung  ungkap perempuan rundung sebut  kembang teknologi wawas lingkung rujuk atur wali kota  wali  bontang nomor tahun kurang produk plastik sekali pakai  lalu kembang teknologi  harap volume sampah bontang tekan tahun   kelola sampah milik nilai ekonomi masyarakat  ucap  tahu  volume sampah kota bontang tahun bilang cukup tinggi  hari  jumlah sampah hasil masyarakat capai ton   ton sampah plastik  terang  lama  sampah plastik bontang cacah kirim pulau jawa  padahal kelola baik benar  sampah - sampah manfaat beri nilai ekonomi cukup tinggi   situ lah coba olah sendiri limbah sampah plastik kota bontang  kata  dosen tim teliti stti bontang ahmad yani tutur  jauh  olah limbah gas metan bontang  kata  limbah sampah plastik kota taman  sebut bontang - kelola sendiri kembang teknologi  sampah beri nilai ekonomi    harga bahan bakar minyak jenis premium jual rp ribu per liter  kalau limbah sampah plastik kelola sendiri  harga tekan  kata  sisi  masyarakat perlu khawatir plastik   limbah sampah kelola jadi bbm  bbm hasil bukan premium  upa solar pertalite   lama batas alat  ujar  olah sampah jadi bbm  baik irhamni  ahmad yani  tiga rekan  manfaat barang bekas beli tempat loak tabung freon  kaleng biskuit  selang besi   semua bahan beli rp ribu  hasil uji coba laku  bahan bakar minyak hasil nyata pakai buat motor  kata  ahmad yani yakin  alat olah sampah modifikasi mungkin  masyarakat bontang manfaat baik aman  sekarang tinggal bagaimana dukung dana stakeholder kait   apabila alat sederhana lurah rt  banyak sampah rang  ucap  satu kilogram sampah hasil mililiter bbm manfaat teknologi buat irhamni kawan - kawan bilang cukup sederhana  limbah sampah plastik cacah masuk tabung freon panas atas kompor gas  hasil bakar kemudian alir lalu buah selang besi dingin kaleng biskuit   minyak olah tampung toples  ahmad yani terang  ideal olah sampah plastik satu kilogram hasil bbm satu liter  batas alat  satu kilogram sampah baru mampu hasil mililiter bbm   uji  perlu laku sempurna   sisa hasil bakar manfaat paping blok  kata  irhamni cerita  olah limbah sampah pernah ajar ilmu teknik kimia  khusus konversi energi  kata  prinsip  energi ubah satu bentuk bentuk  energi musnah  hancur   sampah plastik buat bahan minyak  sekarang bagaimana olah minyak  kata,False,True,False,False,True,False,False,False,True,False,False,True
1120,daur ulang kreatif  cara manfaat botol bekas jadi barang nila botol plastik bekas sering kali jadi limbah cari lingkung  padahal  sedikit kreativitas  botol bekas ubah jadi barang lebih manfaat  pot tanam  tempat simpan  bahkan rajin dekoratif  artikel bahas cara - cara manfaat botol bekas mudah langkah - langkah buat  tahap manfaat botol bekas  ide manfaat mulai  fungsi baru botol bekas  beberapa ide kreatif liput  pot tanam vertikal tempat simpan alat tulis wadah sabun cair lampu hias botol plastik  kumpul alat bahan siap botol bekas alat dukung  gunting cutter lem tembak cat spidol dekorasi tali  kain  bahan tambah  bersih siap botol cuci botol sabun hilang sisa isi bau  kering lebih mudah olah   potong bentuk sesuai butuh gunting cutter potong botol sesuai desain  hati - hati potong hasil rapi luka tangan   hias sempurna bentuk tambah warna  gambar  elemen dekoratif hasil lebih tarik  pot tanam  buat lubang kecil bawah drainase air   rawat hasil daur ulang selesai  hasil kreasi sesuai fungsi  buat pot tanam  tanam awat baik tumbuh subur  kreativitas  botol bekas jadi sampah ubah jadi barang manfaat estetis  bantu kurang limbah plastik  jadi peluang usaha coba bisnis daur ulang  cara tips ideas,False,True,False,False,False,True,False,False,True,False,False,True
1140,plastik uang  daur ulang uang  nyata botol plastik sekali pakai harga  fakta  botol plastik bekas milik nilai ekonomis daur ulang jadi produk baru  teknologi daur ulang  limbah plastik hasil bahan baku buat produk - produk plastik baru  lalu transisi ekonomi linier jadi ekonomi sirkular  untung daur ulang botol plastik bekas  tarik jadi usaha modal sampah plastik  temu ajar lebih lanjut ikut webinar  bit  ly  plastik - uang universitasindonesia,False,False,True,False,False,True,False,False,True,False,False,True
1154,siap kirim seluruh indonesia yuk mau usaha daur ulang limbah plastik ikut workshop cv berkah plastik winking face bimbing jelas mentor profesional owner langsung dr cv berkah plastik usaha daur ulang limbah plastik siap bantu bimbing mula mau gelut bisnis limbah plastik sedia mesin cacah plastik bagai kapasitas ukur sesuai butuh owner  siap terima tampung hasil cacah plastik harga pabrikan  lokasi  office   jl  wilalung ds  tawan merak  kec  dempet kab  demak jateng  jl  jeruk vii no semarang monggo yg mau kunjung sila tanya gratis siap layan jam insya allah amanah percaya sila minat mau tanya konsultasi tlp telephone wa mobile phone with arrow  terimakasih   matursuwun folded handsgrinning face with smiling eyes limbahplastik cacahanplastik usahaplastik bisniscacahanplastik peluangusaha bisnissemarang bisnisdemak purwodadi demak semarang daurulanglimbahplastik daurulang mesinpencacahplastik jualmesincacahanplastik jualmesinpencacahplastik jualmesingilinganplastik mesincacahplastik gilinganplastik bijiplastik sampahplastik mesincacahplastikkalimantan bisniskalimantan,False,False,True,False,True,False,False,False,True,False,False,True
1165,hai sahabatbahari  tahu sih kalau sampah plastik jadi beberapa jenis lho  jenis sampah plastik golong dasar bahan baku  material hingga  bahkan beberapa sampah plastik nyata daur ulang  nah  jadi jangan sampah plastik buang sembarang bahkan cari laut  yuk sama ikut mimin selalu bersih sampah plastik sebar pesisir laut  winking face ekonomi biru indonesia kkpaccelerate ekonomibiru kkpgoid menterikkp saktiwahyutrenggono sampahplastik,False,False,True,False,False,True,False,False,True,True,False,False
1179,botol plastik vs botol kaca konteks air minum kemas biasa sedia kamar - kamar hotel  botol kaca lebih ramah lingkung banding botol plastik  botol plastik botol plastik punya beberapa lebih praktis  tamu bawa penting luar hotel  angkut lebih ringan perlu trip  antar botol isi  jejak karbon lebih sedikit  lemah timbul sampah plastik  siasat manajemen kelola sampah baik cara recycling  daur ulang  botol plastik air minum kemas bahan pet daur ulang beberapa kali jadi sumber industri daur ulang ekosistem circular economy  bagaimana botol kaca  walaupun sedikit lebih mahal  botol kaca jadi pilih baik utama kurang sampah botol plastik kes ramah lingkung walaupun praktis sisi tamu bawa keluar lingkung kamar  jangan lupa angkut botol kaca sumbang carbon footprint lebih besar berat muat lebih tinggi perlu kali trip  angkut botol isi angkut botol kosong  proses sanitasi botol ulang perlu air jumlah banyak zat kimia bersih masuk tanah  tutup botol kaca bahan logam rupa sampah  daur ulang kelola baik  jadi simpul mana lebih baik  sama - sama baik sama - sama punya lemah  perlu sadar prilaku kelola sampah bijak  tamu hotel  lebih suka kemas plastik lebih praktis  botol kosong masuk tempat sampah daur ulang  recycling bin biasa sedia hotel ,False,True,False,False,False,True,False,False,True,False,False,True
1182,sahabat  lawan polusi sampah plastik laku daur ulang optimal potensi nilai ekonomis lho  salah satu cara lalu model daur ulang  rantai daur ulang jadi kunci utama terap ekonomi circular  laku daur ulang sampah plastik produk daur ulang kurang tumpu sampah tpa  model daur ulang milik nilai ekonomi masyarakat dukung industri - industri olah sampah ,False,False,True,False,True,False,False,False,True,False,False,True
1196,sampah plastik jadi masalah global atas dampak lingkung  kerja sama inovasi bagai lapis masyarakat perlu libat tanggulang masalah sampah plastik   perintah upaya manfaat potensi sampah plastik jadi nila ekonomis gandeng usaha masyarakat kurang sampah plastik lalu cara daur ulang manfaat potensi komoditas ekspor    lalu asistensi laku bea cukai wilayah sumatera utara bea cukai kualanamu pt polindo utama  hasil laksana lepas ekspor perdana sabtu  lokasi medan upa produk polyethylene terephthalate  pet  hasil daur ulang sampah plastik banyak kontainer produk pet masing - masing berat ton negara tuju taiwan  hasil daur ulang produk pet kemudian manfaat jadi bagai bentuk kemas  serat bahan buat pakai sepatu olahraga  positif libat umkm kumpul sedia produksi ekspor   kerja sama bagai pihak jalan misi perintah tanggulang dampak negatif sampah lingkung lalu kembang milik nilai jual cipta layan dukung investasi cipta lapang kerja   sahabat bc  yuk dukung kolom komentar segala upaya perintah dorongekspor bagai komoditas potensi ekspor terus jalan optimal      beacukaimakinbaik  ekspor plastik  recycling,False,False,True,False,False,True,False,False,True,False,False,True
1207,pabrik daur ulang sampah plastik baguna lokasi camat damar  resmi langsung anggota dpr ri rudianto tjen  sabtu  datang rudianto tjen damping ketua dpc pdip belitung timur  fezzi uktolseja anggota dprd provinsi nata sumitra sama rombong sambut langsung ketua baguna dpc pdip belitung timur kamarudin muten   ide pabrik sangat luar biasa  kalau lihat sampah kan ganggu hidup  nah sampah plastik olah beri nilai tambah ekonomi masyarakat  ujar wartawan  nilai  bel sampah plastik pabrik daur ulang sampah plastik baguna nila rp kilogram   harap menggerkan ekonomi rakyat  belitung timur seluruh pulau belitung bangka belitung umum  ujar   ide pabrik sampah plastik  bicara tingkat pusat  pikir  bila buat pabrik daur ulang sampah plastik tiap dpc se indonesia  luar biasa tambah nilai ekonomi masyarakat  pdiperjuangan bangunlahjiwadanbadannya tahunpdiperjuangan,False,False,True,False,True,False,False,True,False,False,False,True
